{
  "$schema": "urn:filecheap.dev:artifact-ref:v1",
  "version": 1,
  "provider": "fcheap-cloud",
  "uri": "fcheap://cloud/vaults/vlt_01/artifacts/art_01",
  "artifact_id": "art_01",
  "kind": "cairntrace.run",
  "producer": {
    "tool": "cairntrace",
    "version": "1.8.0",
    "native_schema": "urn:cairntrace.dev:run:v1",
    "native_id": "run_01",
    "entrypoint": "run.json"
  },
  "web_url": "https://artifacts.example/artifacts/art_01"
}
